question,answer
What is the 4C Research Lab?,"The 4C Research Lab (Cognition, Consciousness, and Critical Care Research Group) is a research laboratory focused on advancing pediatric critical care through innovative research in cognition, consciousness, and critical care. We are based at Western University and London Health Sciences Centre in London, Ontario, Canada."
What does 4C stand for?,"4C stands for Cognition, Consciousness, and Critical Care. Our research focuses on these four core areas: Cognition (brain function and cognitive processes), Consciousness (awareness and consciousness states), Critical Care (intensive care medicine), and Comfort (patient comfort and care)."
Who is the Principal Investigator?,"Dr. Saptharishi (Rishi) Ganesan is the Principal Investigator and Head of the 4C Research Group. He is an Assistant Professor in the Department of Paediatrics and Physiology & Pharmacology at the Schulich School of Medicine, Western University, and a Paediatric Intensivist at London Health Sciences Centre."
What are the main research areas?,"Our main research areas include: 1) Pediatric Neurocritical Care, 2) Brain connectivity and consciousness monitoring, 3) Delirium detection and prevention, 4) EEG-based neuromonitoring, 5) Cognitive outcomes in critically ill children, 6) Implementation science in critical care, and 7) Quality improvement in pediatric intensive care."
What current research projects are you working on?,"We have several active research projects: 1) NuANCEd - Nurse-led Advanced Neuromonitoring in Critically ill children with Encephalopathy, 2) TraNSIEnCe - Tracking Neurocognitive States In Encephalopathic Critically ill children, 3) PREDICT ABI - Predicting Acquired Brain Injury outcomes, 4) ABOVE - Advancing Brain Outcomes in paediatric critically ill patients sedated with Volatile Anesthetic Agents, and 5) NORSE - New Onset Refractory Status Epilepticus Registry."
How can I join the 4C Research Lab?,"To join our research team, send your CV to Dr. Rishi Ganesan at rishi.ganesan@lhsc.on.ca. We welcome students, researchers, and healthcare professionals interested in pediatric critical care research. Visit our 'Join 4C Lab' page for more information about opportunities."
What are the contact details?,"You can contact us at: Email: rishi.ganesan@lhsc.on.ca, Phone: (519) 685-8500 Ext. 74702, Address: 800 Commissioners Rd E., London, ON N6A 5W9. Our Research Coordinator is Ms. Maysaa Assaf (Maysaa.Assaf@lhsc.on.ca)."
Where is the lab located?,"The 4C Research Lab is located at Victoria Hospital & Children's Hospital, 800 Commissioners Rd E., London, ON N6A 5W9, Canada. We are part of London Health Sciences Centre and affiliated with Western University."
What technologies do you use in your research?,"We use various advanced technologies including: EEG (electroencephalography), fNIRS (functional near-infrared spectroscopy), processed EEG (qEEG), neuroimaging techniques, machine learning algorithms, and digital health platforms for monitoring and data collection."
What is the NuANCEd project?,"NuANCEd (Nurse-led Advanced Neuromonitoring in Critically ill children with Encephalopathy) is an integrated knowledge translation project that develops and implements a nurse-led processed EEG (qEEG) based seizure screening program to minimize delays in seizure diagnosis and treatment in critically ill children."
What is the TraNSIEnCe project?,"TraNSIEnCe (Tracking Neurocognitive States In Encephalopathic Critically ill children) aims to characterize functional and effective brain connectivity in critically ill children at varying degrees of risk for delirium using EEG and fNIRS techniques to identify objective predictors of delirium."
What is the ABOVE project?,"ABOVE (Advancing Brain Outcomes in paediatric critically ill patients sedated with Volatile Anesthetic Agents) is a multicenter randomized controlled trial comparing inhaled anesthetics versus IV sedative agents to improve delirium in mechanically ventilated children."
What is the NORSE project?,"NORSE (New Onset Refractory Status Epilepticus Registry) is a multicenter study collecting health data and biological samples to understand the causes of cryptogenic new-onset refractory status epilepticus and determine optimal management strategies."
What are the research objectives?,"Our research objectives include: 1) Developing early detection methods for neurological problems, 2) Improving long-term cognitive outcomes in critically ill children, 3) Implementing evidence-based monitoring tools, 4) Advancing understanding of brain states in critical illness, and 5) Translating research findings into clinical practice."
What funding sources support your research?,"Our research is supported by various funding sources including: AMOSO Opportunities Fund, Brain Canada Future Leaders in Brain Research Award, CIHR Project Grants, Lawson Health Research Institute Internal Research Fund, Western University Academic Development Fund, and Investigator Initiated Trials."
What publications has the lab produced?,"Our lab has published numerous peer-reviewed articles in high-impact journals including Neurocritical Care, Resuscitation, Paediatrics & Child Health, and others. You can find our publications on our website, ORCID profile, Google Scholar, and ResearchGate."
How can I collaborate with the 4C Research Lab?,"We welcome collaborations with researchers, clinicians, and institutions. Contact Dr. Rishi Ganesan at rishi.ganesan@lhsc.on.ca to discuss potential collaborations, research partnerships, or clinical trials."
What are the lab's operating hours?,"Our lab operates Monday–Friday: 9:00 AM–5:00 PM. We are closed on weekends and holidays. For urgent matters, please contact Dr. Ganesan directly."
What equipment and facilities do you have?,"We have access to state-of-the-art equipment including EEG machines, fNIRS devices, neuroimaging facilities, data analysis workstations, and clinical research infrastructure at London Health Sciences Centre and Western University."
What is the lab's mission?,"Our mission is to improve the long-term cognitive and functional outcomes in critically ill children through the development, validation, and implementation of electrical neuroimaging-based monitoring tools that provide real-time information about brain states."
What are the key research methodologies?,"Our key methodologies include: 1) Clinical trials and observational studies, 2) EEG and neurophysiological monitoring, 3) Neuroimaging and brain connectivity analysis, 4) Implementation science approaches, 5) Quality improvement methodologies, and 6) Machine learning and data analytics."
How can students get involved?,"Students can get involved through: 1) Research assistant positions, 2) Undergraduate research projects, 3) Graduate student opportunities, 4) Summer research programs, 5) Volunteer positions, and 6) Clinical rotations. Contact us with your CV and research interests."
What are the lab's achievements and awards?,"Our lab has received several awards including: S. T. Achar award, IJP Best Thesis award, Global Health award for research excellence, Brain Canada Future Leaders in Brain Research Award, and recognition for teaching excellence."
What is the lab's approach to patient care?,"Our approach integrates research with clinical care, focusing on evidence-based practices, family-centered care, and improving patient outcomes through innovative monitoring and treatment strategies in pediatric critical care."
What conferences and presentations do you attend?,"We regularly present at major conferences including: Pediatric Academic Societies (PAS), Society of Critical Care Medicine (SCCM), American Academy of Pediatrics (AAP), and international neurocritical care and neuroscience conferences."
What is the lab's publication policy?,"We follow standard academic publication policies, ensuring proper authorship attribution, peer review processes, and open access when possible. All publications are listed on our website and academic profiles."
How can I access the lab's research data?,"Research data access is governed by institutional review board (IRB) approvals and data sharing agreements. Contact us for specific data requests, ensuring compliance with privacy and ethical guidelines."
What are the lab's future research directions?,"Future directions include: 1) Expanding neuromonitoring technologies, 2) Developing AI-based diagnostic tools, 3) Large-scale multicenter studies, 4) Implementation of precision medicine approaches, and 5) International collaborations."
What is the lab's impact on clinical practice?,"Our research has influenced clinical practice by: 1) Improving seizure detection protocols, 2) Advancing delirium assessment methods, 3) Enhancing neuromonitoring standards, 4) Developing evidence-based guidelines, and 5) Training healthcare professionals."
What are the lab's partnerships and collaborations?,"We collaborate with: 1) London Health Sciences Centre, 2) Western University, 3) Lawson Health Research Institute, 4) Children's Health Research Institute, 5) Brain & Mind Institute, 6) International research consortia, and 7) Industry partners."
What is the lab's approach to innovation?,"Our innovation approach includes: 1) Translational research from bench to bedside, 2) Technology development and validation, 3) Implementation science methodologies, 4) Interdisciplinary collaboration, and 5) Patient and family engagement in research."
What are the lab's educational initiatives?,"Educational initiatives include: 1) Training programs for healthcare professionals, 2) Student mentorship and supervision, 3) Continuing medical education, 4) Research methodology workshops, and 5) Knowledge translation activities."
What is the lab's commitment to diversity and inclusion?,"We are committed to diversity and inclusion in our research team, study participants, and research questions. We welcome individuals from all backgrounds and promote equitable access to research opportunities."
What are the lab's quality assurance measures?,"Quality assurance measures include: 1) Regular protocol reviews, 2) Data quality checks, 3) Standard operating procedures, 4) Continuous monitoring and evaluation, 5) Compliance with regulatory requirements, and 6) Regular team training."
What is the lab's approach to knowledge translation?,"Our knowledge translation approach includes: 1) Stakeholder engagement, 2) Evidence synthesis and dissemination, 3) Implementation strategies, 4) Evaluation of impact, 5) Continuous improvement, and 6) Public engagement activities."
What is the PREDICT ABI project?,"PREDICT ABI (Predicting outcomes in critically ill children with acquired brain injury) is a pilot prospective observational study using functional neuroimaging (high density EEG, functional MRI and functional near-infrared spectroscopy) to improve the accuracy and precision of predicting neurological outcomes in unresponsive critically ill children with moderate-severe acquired brain injury."
What is the CONN & SCOR - SRS project?,"CONN & SCOR - SRS (Connectivity and Scoring - Standardized Rating Scale) is an active project focused on developing standardized rating scales for connectivity and scoring in pediatric critical care research."
What is the IN-SYNCC project?,"IN-SYNCC (Integrated Synchronization and Consciousness) is an active project focused on understanding consciousness through integrated synchronization studies in critically ill children."
What is the NOPE-ICU project?,"NOPE-ICU (Non-Pharmacological Interventions in ICU) is an active project focused on developing and implementing non-pharmacological interventions to improve patient outcomes in intensive care units."
What is the DOSM-PCCU project?,"DOSM-PCCU (Digital Outcomes and Safety Monitoring in PCCU) is an active project focused on digital monitoring of outcomes and safety in pediatric critical care units."
What is the BRAIN-CASH project?,"BRAIN-CASH (Brain Computer-Aided Scoring and Health) is a planning-stage project focused on computer-aided scoring and health monitoring for brain function in critical care settings."
What is the ABOVE 2.0 project?,"ABOVE 2.0 (Enhanced Advanced Brain Outcomes) is a planning-stage project that builds upon the original ABOVE study to further advance brain outcome research in pediatric critical care."
What is the TRANSCIENCE project?,"TRANSCIENCE (Transient consciousness and cognitive science) is an active project focused on understanding transient consciousness states and cognitive science in critically ill children."
How can I apply for research positions?,"To apply for research positions, send your CV and a cover letter explaining your interest to rishi.ganesan@lhsc.on.ca. Include academic transcripts if applicable and be prepared to provide references upon request."
What types of research positions are available?,"Available positions include: 1) Research assistants, 2) Graduate students, 3) Postdoctoral fellows, 4) Clinical research coordinators, 5) Data analysts, and 6) Volunteer research positions."
What is the application process for joining the lab?,"The application process involves: 1) Sending CV to rishi.ganesan@lhsc.on.ca, 2) Including a brief cover letter, 3) Team review of application, 4) Interview if selected, and 5) Reference checks and final selection."
What are the requirements for joining the lab?,"Requirements vary by position but generally include: 1) Relevant academic background, 2) Research experience, 3) Strong organizational skills, 4) Attention to detail, 5) Teamwork abilities, and 6) Interest in pediatric critical care research."
What is the lab's blog about?,"Our 4C Research Blog explores the frontiers of neuroscience through insights, research updates, and stories from our work in cognition, consciousness, and critical care. It features articles on our latest research findings, team experiences, and developments in pediatric critical care."
How can I stay updated with lab news?,"You can stay updated by: 1) Following our blog, 2) Checking our publications page, 3) Following our social media profiles, 4) Subscribing to our newsletter, and 5) Contacting us directly for specific updates."
What is the Knowledge Mobilization page?,"The Knowledge Mobilization page provides resources for patients, nurses, and healthcare professionals, bridging the gap between research and practice through education and evidence-based resources."
What resources are available for healthcare professionals?,"Resources for healthcare professionals include: 1) Clinical guidelines, 2) Best practices in ICU care, 3) Delirium assessment tools, 4) Research publications, 5) Case studies, and 6) Family communication guides."
What resources are available for patients and families?,"Resources for patients and families include: 1) Understanding delirium guides, 2) Caregiver handbooks, 3) Patient recovery stories, 4) Educational materials, and 5) Support resources."
What is the research diagram?,"The research diagram is a visual representation of our comprehensive research areas organized around the four core pillars: Cognition, Consciousness, Critical Care, and Comfort, showing the interconnected nature of our projects."
How can I access the lab's publications?,"You can access our publications through: 1) Our website's publications page, 2) ResearchGate profile, 3) Google Scholar profile, 4) ORCID profile, and 5) Direct links to journal articles."
What is the lab's approach to patient safety?,"Our approach to patient safety includes: 1) Rigorous protocol development, 2) Continuous monitoring, 3) Regular safety reviews, 4) Compliance with regulatory standards, 5) Team training, and 6) Quality improvement initiatives."
What is the lab's role in the community?,"Our community role includes: 1) Providing expert consultation, 2) Educational outreach, 3) Public health initiatives, 4) Professional development, 5) Research collaboration, and 6) Knowledge sharing."
What is the lab's approach to mentorship?,"Our mentorship approach includes: 1) Individual guidance, 2) Skill development, 3) Career planning, 4) Research training, 5) Professional networking, and 6) Continuous support."
What is the lab's commitment to research integrity?,"Our commitment to research integrity includes: 1) Ethical research practices, 2) Transparent methodology, 3) Data integrity, 4) Proper attribution, 5) Peer review, and 6) Open communication."
What is the lab's approach to interdisciplinary collaboration?,"Our interdisciplinary approach includes: 1) Cross-departmental partnerships, 2) Multi-institutional collaborations, 3) Industry partnerships, 4) International networks, 5) Clinical-academic integration, and 6) Technology partnerships."
What is the lab's vision for the future?,"Our vision is to become a global leader in pediatric critical care research, advancing the understanding of brain function in critical illness and improving outcomes for children worldwide through innovative research and clinical practice." 